Rank,Hospital,Country1762,Beijing University of Chinese Medicine and Pharmacology Dongfang Hospital,China 1766,First Hospital of Hebei Medical University,China 1766,First Affiliated Hospital of Zhengzhou University,China 1798,First Hospital of Sanming City,China 1805,Xiamen Chang Gung Hospital,China 1816,Hebei Medical University Fourth Hospital,China 1818,Zhejiang University School of Medicine Hospital of Stomatology,China 1856,Shanghai Children's Medical Center,China 1885,Shenzhen Sunshine Hospital,China 1898,Sino-Japanese Friendship Hospital Jilin University,China 1921,Liaocheng City People's Hospital,China 1924,Mary's Hospital Women & Children Beijing,China 1928,Shanghai Tenth People's Hospital,China 1933,Meishan City Hospital of Traditional Chinese Medicine,China 1938,Plastic Surgery Hospital of Chinese Academy of Medical Sciences,China 1948,Affiliated to Shandong University Jinan Central Hospital,China 1952,Shanghai Nanpu Maternity Hospital,China 1980,Seventh People's Hospital of Jinan Jiyang County People's Hospital,China 1994,Jiangxi Provincial Tumor Hospital Jiangxi Second People's Hospital,China 2024,Sun Yat-sen University Shantou Central Hospital,China 2030,First Affiliated Hospital of Xi'an Jiaotong University School of Medicine,China 2057,First People's Hospital of Tai'an City,China 2065,Affiliated Hospital of Zunyi Medical College,China 2065,Shangrao City People's Hospital,China 2080,Peking University Sixth Hospital,China 2122,Guangzhou Center for Disease Control and Prevention,China 2125,Peking Union Medical College Hospital Vascular Surgery,China 2128,Beijing Shijitan Hospital,China 2147,First Affiliated Hospital of Xiamen University,China 2152,Shenzhen Luohu District Hospital of Traditional Chinese Medicine,China 2169,Affiliated Hospital of Jiangsu University (Zhenjiang City Riverside Hospital),China 2175,Guangzhou Huamei Medical Cosmetic Surgery Hospital,China 2179,Affiliated Hospital of Guilin Medical College,China 2186,Guanghan City Orthopaedic Hospital,China 2203,Affiliated Hospital of Jining Medical College,China 2220,Henan Tumor Hospital Zhengzhou University,China 2229,Matilda International Hospital,China 2257,Affiliated Hospital of Chengde Medical College,China 2266,Tianjin Municipal People's Hospital,China 2270,Chongqing Municipal Center for Disease Control and Prevention,China 2290,Xinxiang Central Hospital,China 2290,Beijing Huilongguan Hospital,China 2297,First Affiliated Hospital of Bengbu Medical,China 2307,Guangzhou 458 Air Force Hospital,China 2325,Maternal and Child Health Hospital of Fuyang City,China 2326,Tsinghua University Yuquan Hospital,China 2383,Space Center Hospital Aerospace Clinical Medical College Peking University,China 2388,Lu'an City People's Hospital,China 2436,PLA Second fifty-one hospital,China 2473,Dongzhimen Hospital,China 2490,Nanjing General Hospital of Nanjing Military Command,China 2493,Lechang City People's Hospital,China 2519,Qinghai Province Traditional Chinese Medicine Hospital,China 2530,Shenzhen Luohu People's Hospital,China 2542,Shanghai Red House Hospital of Obstetrics and Gynecology / Obstetrics and Gynecology Hospital of Fudan University,China 2557,First Teaching Hospital of T.J.U.T.C.M.,China 2561,Hebei Province Traditional Chinese Medicine Hospital,China 2602,Ningbo Municipal Hospital of Traditional Chinese Medicine,China 2612,Nanhai District of Foshan Third People's Hospital,China 2655,Wuhan First Hospital,China 2673,Second People's Hospital of Shaanxi Province,China 2697,First People's Hospital of Huizhou City,China 2703,Cancer Hospital of Nantong City,China 2750,Tianjin Medical University Eye Centre,China 2767,Shuangfeng People Hospital,China 2785,Second Affiliated Hospital of Shantou University Medical College,China 2787,Third Affiliated Hospital of Sun Yat-sen University,China 2795,Putuo District Central Hospital,China 2810,First Affiliated Hospital of Shantou University Medical College,China 2857,Longyan City Hospital,China 2898,Tianjin TEDA Hospital,China 2898,Shenyang City Songliao laser Hospital,China 2903,Children's Hospital of Kunming,China 2930,Jiangsu Cancer Hospital,China 2983,Second Hospital of Lishui City,China 2983,Shanghai Men Hospital Kowloon Hong Kong Chamber of Commerce designated welfare hospital _ _ male urology professional (male),China 2995,Chuzhou Integrative Medicine Hospital,China 3026,Tianjin First Central Hospital,China 3040,Weifang People's Hospital,China 3070,ParkwayHealth China (Worldlink Shanghai Medical Centre),China 3073,Liaoning Medical College Hospital,China 3105,Changchun plastic surgery hospital,China 3109,Gynecological Hospital of Kunming,China 3148,First People's Hospital of Hefei,China 3184,Beijing United Family Hospital,China 3199,Laiwu Steel Hospital,China 3203,Second Affiliated Hospital of Guiyang College of Traditional Chinese Medicine,China 3247,Affiliated Tumor Hospital of Guangzhou Medical College,China 3257,Reproduction & Genetics Hospital Citic Xiangya,China 3269,Harbin Medical University the Second Affiliated Hospital,China 3278,Weifang Medical College Hospital,China 3376,Hubei Cancer Hospital,China 3406,First People's Hospital of Guiyang City,China 3420,Beijing Geriatric Hospital (formerly Beijing Chest Hospital),China 3427,Shenzhen City children's hospital,China 3453,First Affiliated Hospital of Henan University of Science and Technology (Luoyang City Third People's Hospital),China 3456,81 Hospital of the People's Liberation Army,China 3471,Hangzhou Maria Maternity Hospital,China 3493,Second Hospital of Tianjin Medical University,China 3493,Shenzhen plastic surgery hospital,China 3516,Longchang County People's Hospital,China 3523,Wuhan Asia Heart Hospital,China 3550,Beijing Antai Hospital,China 3566,Binzhou Medical College Hospital,China 3600,Wenzhou Medical College Hospital of Stomatology,China 3631,Dermatology Hospital of Hainan Province,China 3642,Shenzhenbuji Hospital,China 3647,Tin Hua Fifth Hospital,China 3650,Chongqing Fuling Central Hospital,China 3676,Sixth People's Hospital of Huizhou City Huiyang District People's Hospital,China 3739,Chinese Academy of Medical Sciences Institute of Hematology and Blood Diseases Hospital,China 3896,Youjiang Medical College Hospital,China 3896,Nanchang Second Hospital,China 3911,Beijing An Ding Hospital,China 3928,(1)  People's Liberation Army Bethune International Peace Hospital,China 3936,Children's Hospital of Zhengzhou City,China 3940,First Affiliated Hospital Harbin Medical University,China 3958,Huanggang Central Hospital,China 3973,Tianjin Eye Hospital,China 3979,First People's Hospital of Yichang City,China 3984,Xuzhou Central Hospital,China 4005,Affiliated Hospital of North Sichuan Medical College,China 4014,Second People's Hospital of Sichuan,China 4033,First People's Hospital of Zhenjiang City,China 4041,Guangzhou Chest Hospital,China 4078,Yiwu Affiliated Hospital of Zhejiang University School of Medicine,China 4102,He Eye Hospital,China 4123,Anqing City Hospital,China 4157,Fourth People's Hospital of Zigong City,China 4220,Aviation General Hospital,China 4230,(1)  First Hospital of Shanxi Medical University,China 4234,Rudong County Jiangsu Province People's Hospital,China 4244,Xi'an Shaanxi Hospital,China 4280,Shanghai Traditional Chinese Medicine,China 4287,Third People's Hospital of Hangzhou,China 4314,Liuzhou People's Hospital,China 4331,Tiantai County People's Hospital,China 4391,Guangzhou Children's Hospital,China 4398,Workers' Hospital of Henan Province,China 4403,Shaoxing City Hospital,China 4409,Capital Medical University Beijing Chest Hospital,China 4416,Yellowstone Central Hospital,China 4458,Fourth Hospital of Xi'an,China 4464,Ningbo City Mental Hospital,China 4480,Weihai Wendeng Central Hospital,China 4501,Yangzhou University Affiliated Luhe Hospital,China 4534,Guangzhou First People's Hospital,China 4556,Shenzhen peace Male Hospital,China 4556,Guangzhou Chang'an Hospital,China 4570,Children's Hospital of Xuzhou City,China 4574,Zhuji City People's Hospital,China 4611,Third Hospital of Xinxiang Medical University,China 4616,Shenzhen Traditional Chinese Medicine Hospital,China 4648,People's Hospital of Leshan,China 4656,SouhtWest Hospital,China 4665,First People's Hospital of Jiujiang City,China 4680,Shanghai Jiaotong University School of Medicine Third Affiliated People's Hospital,China 4714,Lin'an City People's Hospital,China 4744,Shandong University of Traditional Chinese Medicine Second Affiliated Hospital,China 4749,Nanjing First Hospital of Ophthalmology,China 4766,Linyi Peopleäó»S Hospital,China 4766,Sui Changxian Hospital,China 4778,Yunxi People's Hospital,China 4778,Seventh People's Hospital of Zhengzhou City,China 4788,Xi'an Medical College Hospital,China 4811,Qiqihar Medical Third Affiliated Hospital,China 4829,Yichun City People's Hospital,China 4846,Mianyang Stomatology Hospital,China 4855,People's Liberation Army Shanghai 455 Hospital,China 4884,Dalian Sunshine Hospital,China 4925,303 People's Liberation Army Hospital of Guangxi,China 4932,Institute of China Academy of Chinese Medical,China 4943,First Affiliated Hospital Chengdu Medical College,China 4945,Guangzhou Eighth People's Hospital,China 4979,Songyang County People's Hospital,China 4982,Affiliated Eye Hospital of the Wenzhou Medical College,China 4982,Hospital of Hebei Province Hebei Mental Health Center,China 5005,Shenzhen Kin Hospital,China 5037,Hebei University Hospital,China 5037,Guangrao County People's Hospital,China 5044,Henan Chest Hospital,China 5089,Lu'an City Hospital of Traditional Chinese Medicine,China 5124,Tianjin Third Central Hospital Tianjin Hepatology Hospital,China 5148,Tumor Hospital of Huainan Oriental Hospital Group,China 5148,Beijing Brain Hospital Sanbo,China 5157,Affiliated Hospital of Hebei University of Engineering,China 5176,Shenzhen Friendship Hospital,China 5176,Hefei Stomatological Hospital,China 5185,Guangzhou Brain Hospital,China 5189,First People's Hospital of Huainan City,China 5205,Ganzhou Maternity & Child Health Hospital,China 5213,Jinshan Hospital Fudan University,China 5221,Chengdu hemorrhoids Hospital Chengdu,China 5240,Luhoe Central Hospital,China 5246,Xijing Hospital Fourth Military Medical University of Cardiovascular Surgery,China 5254,New Century International Children Hospital,China 5261,Puri Eye Hospital Group,China 5280,Xuchang Central Hospital,China 5302,Shanxi Red Cross Stomatological Hospital Taiyuan City,China 5357,Clifford Hospital,China 5361,First People's Hospital of Shenyang City,China 5393,Second Affiliated Hospital of Nanjing Medical University,China 5409,Second People's Hospital of Zhuhai City,China 5434,Brain Tumor Hospital St Michael Hospital,China 5452,Shanghai Yangsi Hospital,China 5482,Affiliated Hospital of Putian University,China 5501,Jiangsu Province People's Hospital in Northern New Area Branch (Third People's Hospital of Yangzhou City),China 5509,Guangyuan Reproductive Health Specialist Hospital,China 5569,Zhangjiagang City People's Hospital Affiliated to Suzhou University,China 5584,Wuxi of Hospitals,China 5611,Stomatology Hospital of Huizhou City,China 5634,Fujian Medical University Nanping First Hospital,China 5638,Jinggangshan University Hospital,China 5638,Ruian City People's Hospital - Third Affiliated Hospital of Wenzhou Medical College,China 5671,Third Affiliated Hospital of Southern Medical University,China 5709,Jianyang City People's Hospital,China 5758,Jinan China Hospital,China 5833,Luoyang Henan bonesetting Hospital,China 5884,Shanghai Guanghua Hospital Integrative Medicine,China 5915,Beijing Union Medical College Hospital,China 5920,Chengdu Blood Center,China 5925,Di Jiusi Chinese People's Liberation Army Hospital,China 5928,Foshan Sanshui District People's Hospital,China 5931,Xuancheng Anhui Province Central Hospital,China 5936,Affiliated Hospital of Hebei University,China 5960,(1)  Shandong Tumor Hospital & Institute,China 5966,Susong Hospital of Traditional Chinese Medicine,China 5977,Anhui Provincial Frienship Hospital,China 5977,Guangzhou Civil Aviation Hospital,China 5977,QuYang Hospital,China 5988,Nanchong Central Hospital,China 6004,New Vision Eye Clinic Shanghai,China 6011,Second Affiliated Hospital of Fujian Medical University,China 6019,Third Affiliated Hospital of Nanjing Nanjing University of Traditional Chinese Medicine,China 6031,Anhui Medical University Dental Hospital,China 6036,Tumor Hospital of Huai'an City Huai'an City Chuzhou Hospital,China 6042,Guangzhou Nanyang Tumor Hospital,China 6051,Northeast Normal University Hospital,China 6065,Chifeng City Hospital,China 6104,Maternal and Child Health Hospital of Qinhuangdao City,China 6130,Fourth Affiliated Hospital of China Medical University,China 6159,First Affiliated Hospital of Xinjiang Medical University,China 6167,Shanghai East International Medical Center,China 6171,Coal General Hospital,China 6208,Maternal and Child Health Hospital of Shenzhen City,China 6227,Shenzhen counseling online training Shenzhen Corning Hospital,China 6256,Yichang City Chinese Medicine Hospital,China 6312,Lishui City Hospital of Traditional Chinese Medicine,China 6320,Shangqiu First People's Hospital,China 6320,Kunshan City Chinese Medicine Hospital,China 6325,Hefei Third People's Hospital,China 6330,Wujin Hospital,China 6338,Pingxiang City People's Hospital,China 6360,People's Hospital of Xinxing,China 6389,Binzhou City People's Hospital,China 6398,Xingyi City People's Hospital,China 6403,Zhoushan City Chinese bone-setting United Christian Hospital,China 6418,Shenzhen luogang Hospital,China 6436,Suizhou Central Hospital,China 6450,Zunyi Hospital,China 6474,Shanghai infertility Hospital,China 6485,Taicang City First People's Hospital,China 6515,Cixi City Chinese Medicine Hospital,China 6576,Xiankangjia Institute of epilepsy,China 6582,Beijing Yanhua Hospital,China 6596,Jinhua Central Hospital,China 6603,Second People's Hospital of Yibin City,China 6604,Seventh People's Hospital of Hangzhou,China 6617,Fourth Hospital of Harbin Medical University,China 6659,Central Hospital of Xiangyang (Xiangfan Central Hospital),China 6665,Zhuji of Zhejiang Province Chinese Medicine Hospital,China 6699,Shandong Provincial Stomatological Hospital Shandong University Dental Hospital,China 6745,Weihai Municipal Hospital,China 6761,Jiulongpo District Hospital,China 6820,Jingdong Sino-US Hospital,China 6888,Fifth People's Hospital of Zigong City,China 6892,Sixth People's Hospital of Hangzhou,China 6925,Women & Children's Hospital of Shantou City,China 6930,Lunan Eye Hospital in Shandong Province,China 6933,Vista Clinic,China 6940,Beijing Yanqing Hospital,China 6949,Shanghai United Family Hospital,China 6953,Changde City Chinese Medicine Hospital,China 6957,Wuhan Yangtze River Transportation General Hospital Brain Hospital of Wuhan,China 6985,Huainan Oriental Hospital Group,China 6993,Neijiang City People's Hospital,China 7023,Beijing Phoenix Hospital Group,China 7025,First People's Hospital of Changshu City,China 7031,Sichuan Orthopedic Kanggu Hospital,China 7046,Beijing Changqing Anorectal Hospital,China 7059,Hong Kong International Medical Clinic Beijing,China 7074,Jiangyin City Jiangyin Hospital of Chinese Medicine Societies,China 7095,Fifth People's Hospital of Suzhou City,China 7095,Beijing Electric Power Hospital,China 7118,Municipal People's Hospital of Jimo,China 7118,Huangdao District Hospital,China 7124,First Affiliated Hospital of Heilongjiang University of Chinese Medicine,China 7159,First People's Hospital of Xiangshan County,China 7184,Sui Zhou Hospital of Traditional Chinese Medicine,China 7190,Dalian City Dental Hospital,China 7194,Dongguan City HengLi Hospital,China 7204,Liver Disease Hospital of Yunnan Province Kunming,China 7208,Pinghu City Second People's Hospital of Jiaxing City Binhai New Area Hospital,China 7208,Guangshui First Municipal People's Hospital,China 7218,Baoding First Central Hospital,China 7229,Fourth Central Hospital of Tianjin,China 7231,Renji Hospital,China 7240,Guangzhou Army General Hospital,China 7267,Beijing Red Cross Tung Wah Hospital,China 7277,Nanjing Ruixin Hospital,China 7368,Second People's Hospital,China 7368,Civil Aviation General Hospital,China 7368,Maternal and Child Health Hospital of Pengzhou,China 7368,First People's Hospital of Xiantao City,China 7399,Dongguan Guangdong Shek Pai Hospital,China 7429,Yongkang First People's Hospital,China 7451,Tongji University Shanghai Oriental Hospital,China 7460,Liaocheng Third People's Hospital,China 7486,Handan City CongTai District Hospital,China 7497,Mental Health Center of Jiangxi Province,China 7541,Taizhou City Hospital of Traditional Chinese Medicine,China 7541,Peking University International Hospital,China 7554,West China School of Stomatology West China Stomatology Hospital,China 7602,General Hospital of Heilongjiang Land Reclamation Bureau,China 7623,Beijing Xuanwu TCM Hospital,China 7628,Dongguan Zhongtang Hospital,China 7649,Nanping City People's Hospital,China 7684,American Sino Ob/Gyn Service Shanghai,China 7748,Third People's Hospital of Changzhou City,China 7764,"Shaoxing Second Hospital www.sxdeyy.cn,",China 7773,Ma'anshan City emergency rescue center,China 7793,Xinyu City Mothers & Children Hospital,China 7793,Guangyuan City Third People's Hospital,China 7797,Jinzhou City Hebei Province People's Hospital,China 7797,Langfang City Dachang County Maternal and Child Health Hospital,China 7810,Yixing (Hongta) Jinling Andrology Hospital,China 7816,Beijing Shijingshan Hospital,China 7838,People's Hospital of Jinyun County,China 7874,Second Affiliated Hospital of Henan University of Science and Technology,China 7891,Jiuquan City People's Hospital,China 7891,Shiyan City Chinese Medicine Hospital,China 7907,Dandong City Hospital,China 7919,Heze Hospital of Traditional Chinese Medicine,China 7955,Stomatological Hospital of Jiangsu Province,China 7968,Jiaxing Shuguang Hospital,China 7979,Second People's Hospital of Shantou,China 7981,Fourth People's Hospital of Shenyang City,China 7996,Shenzhen City manhole People's Hospital,China 8012,Anshan Iron and Steel Group General Hospital,China 8034,Qingdao Changzheng Hospital,China 8053,Shanxi Yuncheng Central Hospital,China 8053,Chongqing Emergency Medical Center (Fourth People's Hospital of Chongqing),China 8065,Beijing Red Cross Emergency Rescue Center,China 8092,Chongqing Changshou District People's Hospital,China 8092,Hospital Haiyang Branch Qingdao University Medical College,China 8111,Henan Anyang Eye Hospital,China 8137,Haikou City People's Hospital,China 8203,Jilin Province Traditional Chinese Medicine Hospital,China 8207,Maternal and Child Health Hospital of Jiujiang City,China 8222,Dongguan City Chayama Hospital,China 8228,Stomatology Hospital of Jining,China 8234,Jiaxing City Yanguan a mental hospital (Haining Fourth People's Hospital),China 8251,Second People's Hospital Panyu Guangzhou,China 8277,Seventh People's Hospital of Shenyang City,China 8280,Wenzhou Maternal and Child Health Network,China 8292,Third People's Hospital of Zhenjiang City,China 8296,Zhejiang University Hospital,China 8309,Shenzhen Baoan Hospital,China 8360,Beijing Renhe Hospital,China 8400,Shaoxing County Central Hospital,China 8406,Fourth People's Hospital of Taizhou City,China 8406,Mental Health Center of Yunnan Province Kunming,China 8422,Tangshan City People's Hospital,China 8469,Third People's Hospital of Zigong City,China 8475,Third Affiliated Hospital of Hebei North University,China 8519,Shanghai Urban Women's Hospital,China 8533,Children's Hospital of Baoding,China 8540,Nanning Municipal Disease Prevention and Control Center,China 8578,Nanchang University Affiliated Hospital of Dermatology,China 8599,Tsinghua University Beijing Tsinghua Hospital,China 8621,Shixin Hospital,China 8633,Huashan Hospital Baoshan Fudan University,China 8635,Ankang Hospital of Traditional Chinese Medicine,China 8662,Wuhu Jinling Men's Hospital,China 8662,Men's Hospital Guangzhou Women's Hospital in Guangzhou,China 8705,Beijing Xiaotangshan Hospital,China 8739,First Hospital of Qiqihar City,China 8746,Beijing Luo Youming Traditional Chinese Medicine Orthopaedic Hospital,China 8757,Sha District People's Hospital,China 8769,Quzhou City Kecheng people Hospital,China 8784,Lanzhou University School of Stomatology,China 8816,Guangdong Agribusiness Center Hospital,China 8819,People's Republic of Zhanjiang City Hospital,China 8868,Yongjia County Hospital,China 8875,Guizhou Provincial Cancer Hospital,China 8891,First Affiliated Hospital of Jinan University (Guangzhou Overseas Chinese Hospital),China 8938,Tianjin Public Security Hospital,China 8938,Tianjin Haihe Hospital,China 9026,Dongfeng flowers and fruits Hospital,China 9031,Maternal and Child Health Hospital of Wanzhou District Chongqing,China 9045,Ningbo First Hospital of Thoracic Surgery Center,China 9051,Second People's Hospital of Guizhou Province,China 9057,Shanghai Feikeyiyuan Thoracic Surgery,China 9064,Maternal and Child Health Hospital of Lanzhou City,China 9076,Shenzhen Fu Huazhong Integrative Medicine Hospital,China 9079,Luozhuang District People's Hospital,China 9091,Dermatology Hospital of Zhejiang Province,China 9119,Luoyang City First Hospital of Chinese medicine,China 9130,Chongqing Traditional Chinese Medicine Orthopaedic Hospital,China 9147,First People's Hospital of Wuyi County,China 9148,Puyang City Eye Hospital,China 9157,Raohe County Chinese Medicine Hospital,China 9163,Third People Hospital of Huizhou,China 9217,Shizhu People's Hospital,China 9221,Beijing Millennium Monument Hospital Ophthalmic Laser Treatment of Myopia Centre,China 9225,Liver disease hospital in Guangzhou,China 9245,Affiliated Hospital of Jingchu University of Technology Third People's Hospital of Jingmen City,China 9245,Huizhou City Maternal and Child Health Hospital,China 9253,Guangzhou Dongfang Hospital,China 9287,Suzhou Municipal Hospital,China 9320,Zhengzhou City Neck and Back Pain Hospital,China 9363,Jiaohe City Hospital,China 9426,Beijing Changfeng Hospital,China 9479,First People's Hospital of Pingdingshan City,China 9488,Heshan City People's Hospital,China 9503,Yuhuan County People's Hospital,China 9503,Xijing Hospital The PLA Otolaringology & Neck Surgery Center Northwestern University Feinberg School of Medicine,China 9506,Third People's Hospital of Qingdao,China 9513,Changshu City Hospital of Traditional Chinese Medicine,China 9520,Tangcheng Hospital Xi'an,China 9520,Changchun Huashan dermatological hospital,China 9528,Armed Police Corps Hospital of Anhui Province,China 9540,Beijing Emergency Medical Center,China 9543,Yingshang County People's Hospital,China 9566,Xinghua City People's Hospital of Yangzhou University Medical College Hospital,China 9575,Penglai City Hospital of Traditional Chinese Medicine,China 9580,Heilongjiang Eye Hospital,China 9580,Heyuan City Hospital,China 9585,Liaoning Fengtian Hospital,China 9602,Yantai City Laiyang Central Hospital,China 9607,Fifth People's Hospital of Wuhu City,China 9626,Lingyuan Central Hospital,China 9639,Shenyang City Mental Health Center - Official Site,China 9694,Xianghe County bronchitis asthma hospital,China 9724,Second People's Hospital of Dalian City,China 9771,Fengtai District Beijing iron camp hospital,China 9773,Linyi County People's Hospital,China 9773,Dalian City Dermatology Hospital,China 9773,Fifth Hospital of Sichuan Province,China 9781,Harbin Engineering University Hospital,China 9798,Beijing Shunyi Hospital,China 9809,Zhuxi County People's Hospital,China 9809,Baoding Second Hospital,China 9850,Third Affiliated Hospital of Gannan Medical College,China 9880,Guangzhou First Municipal People's Hospital Eyes Center,China 9886,Bayley & Jackson Medical Center,China 9889,Wuxi Dermatology Hospital,China 9904,Sixth People's Hospital of Anqing City,China 9935,Liaoning Anshan Tanggangzi Hospital,China 9946,Shandong Provincial Academy of Medical Sciences Affiliated Hospital of Shandong Tumor Hospital,China 9963,Huashan Worldwide Medical Center,China 10005,China People's University Hospital,China 10033,Chinese Second Hospital of Tai'an City,China 10044,First People's Hospital of Guangzhou,China 10057,Dongguan Bright Eye Hospital,China 10057,China Science and Technology University Hospital,China 10104,Hanchuan second People's Hospital,China 10109,Fourth People's Hospital of Foshan City,China 10125,First People's Hospital of Wuhu City,China 10161,Daye City People's Hospital,China 10165,Shenyang City anorectal Hospital,China 10169,Xiangyang City First People's Hospital Affiliated Hospital of Hubei Medical College,China 10177,Jiangmen City Mental Health Network,China 10205,Zhangwu County Hospital,China 10303,Huoshan County Hospital,China 10327,Hunan Provincial Armed Police Corps Hospital,China 10335,Zhangping City Hospital,China 10352,Foshan City the Red Cross Home,China 10378,Central Hospitsal of Jia Mu Si City,China 10404,Second Affiliated Hospital of Hebei North University Xuanhua District Zhangjiakou City Hebei,China 10409,Dongcheng PuRen hospital,China 10415,Chinese medicine hospital in Fuzhou,China 10418,Luoyang 202 Hospital,China 10444,Landseed International Hospital,China 10455,Yan'an City People's Hospital,China 10472,First Affiliated Hospital of Qiqihar Medical College,China 10472,Takamasa County People's Hospital,China 10476,Xingangzhongxinyiyuan,China 10486,Xiangyang Fourth People's Hospital,China 10492,Meixian People's Hospital,China 10499,Ju County Chinese Medicine Hospital,China 